{"conversation_evidence":{"admissible_pre_tfg_turns":[{"create_time":1708195568.230819,"event_index":2,"role":"user","source_node_id":"aaa245df-e994-42b9-8ee4-5f85cb4f0268","source_parent_id":"6b2d0f49-1392-4814-a27d-ad19f1a5e4d5","source_record_index":2,"text":"このソースコードをシンプルにしつつもわかりやすいコードにしてください。\n\n/**\n * 保存に適したフォルダを選択するかキャンセルをするまでダイアログを繰り返し表示し続ける\n * @param showDialogFunction ダイアログを表示する関数\n */\nconst retryShowSaveDialogWhileSafeDir = async <\n  T extends Electron.OpenDialogReturnValue | Electron.SaveDialogReturnValue\n>(\n  showDialogFunction: () => Promise<T>\n): Promise<T> => {\n  const unsafeSaveDirs = [appDirPath, app.getPath(\"userData\")];\n  let retry: boolean;\n  let result: T;\n  do {\n    retry = false;\n    result = await showDialogFunction();\n    let filePath: string;\n    if (result.canceled) {\n      return result;\n    }\n    if (\"filePaths\" in result) {\n      filePath = result.filePaths[0];\n    } else {\n      if (result.filePath == undefined) {\n        return result;\n      }\n      filePath = result.filePath;\n    }\n    for (const unsafeDir of unsafeSaveDirs) {\n      const relativePath = path.relative(unsafeDir, filePath);\n      if (\n        !(\n          path.isAbsolute(relativePath) ||\n          relativePath === \"..\" ||\n          relativePath.startsWith(`..${path.sep}`)\n        )\n      ) {\n        const warningResult = await dialog.showMessageBox(win, {\n          message: \"指定された保存先は自動的に削除される可能性があります。\",\n          type: \"warning\",\n          buttons: [\"保存場所を変更\", \"無視して保存\"],\n          defaultId: 0,\n          title: \"警告\",\n          detail: \"本当にこの場所に保存しますか？\",\n          cancelId: 0,\n        });\n        if (warningResult.response == 0) {\n          retry = true;\n        }\n        break;\n      }\n    }\n  } while (retry);\n  return result;\n};","turn_id":"turn_000002"}],"first_generation":{"artifacts":[{"candidate_id":"GTC_000003_000124_001710_2c0fa2667b1f5aff","completeness":"complete","container":"markdown_fence","continuation_status":"none","detector":{"name":"generated-technical-content-v2","version":"2"},"detector_evidence":["complete_standalone_markdown_fence","declaration","control_flow","braces","statement_terminators","call_expression"],"end_offset":1710,"fence_language":"javascript","kind":"source_code","legacy_artifact_id":"ARTIFACT_000003_001","order_within_response":1,"raw_text":"/**\n * ユーザーが安全でない場所を選択しないようにし、適切な保存場所を選択するか操作をキャンセルするまでダイアログを表示します。\n * @param showDialogFunction ダイアログを表示する関数\n */\nconst retryShowSaveDialogUntilValid = async <\n  T extends Electron.OpenDialogReturnValue | Electron.SaveDialogReturnValue\n>(\n  showDialogFunction: () => Promise<T>\n): Promise<T> => {\n  const unsafeDirs = [appDirPath, app.getPath(\"userData\")];\n  \n  while (true) {\n    const result = await showDialogFunction();\n    // キャンセルされた場合、結果を直ちに返す\n    if (result.canceled) return result;\n    \n    // 選択されたファイルパスを取得\n    const filePath = result.filePaths ? result.filePaths[0] : result.filePath;\n    if (!filePath) return result; // filePathが未定義の場合、結果を返す\n    \n    // 選択されたパスが安全かどうかを確認\n    if (isPathUnsafe(filePath, unsafeDirs)) {\n      const shouldRetry = await showWarningDialog();\n      if (!shouldRetry) return result; // ユーザーが警告を無視して保存を選択した場合\n    } else {\n      return result; // 安全なパスが選択された場合\n    }\n  }\n};\n\n/**\n * 指定されたパスが安全でないかどうかを判断します。\n */\nconst isPathUnsafe = (filePath, unsafeDirs) => {\n  return unsafeDirs.some(unsafeDir => {\n    const relativePath = path.relative(unsafeDir, filePath);\n    return !path.isAbsolute(relativePath) && !relativePath.startsWith('..');\n  });\n};\n\n/**\n * 警告ダイアログを表示し、ユーザーが再試行を選択したかどうかを返します。\n */\nconst showWarningDialog = async () => {\n  const warningResult = await dialog.showMessageBox(win, {\n    message: \"指定された保存先は自動的に削除される可能性があります。\",\n    type: \"warning\",\n    buttons: [\"保存場所を変更\", \"無視して保存\"],\n    defaultId: 0,\n    title: \"警告\",\n    detail: \"本当にこの場所に保存しますか？\",\n    cancelId: 0,\n  });\n  return warningResult.response === 0; // 0: 再試行, 1: 無視して保存\n};\n","raw_text_sha256":"2c0fa2667b1f5aff628a833f03991fa987c029965b6674169a29cb36c6660807","source_event_index":3,"source_record_index":3,"source_response_id":"turn_000003","source_turn_text_sha256":"59645da236dee570c7be8320d68769a997dc4e7ef5d2011ba49f7037197931de","start_offset":124,"status":"candidate_requires_semantic_review"}],"identification":{"ambiguity_reason":"","artifact_refs":["GTC_000003_000124_001710_2c0fa2667b1f5aff"],"boundary":"exclusive_before:turn_000003","candidate_artifact_ids":["GTC_000003_000124_001710_2c0fa2667b1f5aff"],"family_id":"FGF_a55aecb2ddb36f028dfa50e2","family_id_provenance":{"algorithm":"sha256","canonical_input":{"artifact_ids":["GTC_000003_000124_001710_2c0fa2667b1f5aff"],"case_id":"CASE_D988A0CE780E"},"canonicalization":"json-sort-keys-compact-utf8","case_id_included":true,"digest_hex":"a55aecb2ddb36f028dfa50e23ca22668750b7c523af9993114b14f13d92691ef","digest_prefix_length":24},"family_label":"Simplified save-dialog retry and unsafe-path validation implementation","rationale":"The sole candidate is generated in the earliest assistant response and forms one coherent source-code family implementing the requested simplification, including the main retry function and its path-validation and warning-dialog helpers.","response_event_index":3,"response_turn_id":"turn_000003","status":"complete","target_prompt_event_index":2,"target_prompt_id":"turn_000002"}},"first_generation_response":{"create_time":1708195604.440159,"event_index":3,"role":"assistant","source_node_id":"b062fff5-c18b-4e94-a817-84ea8e2e8e3e","source_parent_id":"aaa245df-e994-42b9-8ee4-5f85cb4f0268","source_record_index":3,"text":"このソースコードをよりシンプルかつわかりやすく再構成することを目指します。主な目標は、繰り返しのロジックの簡素化、コードの読みやすさの向上、および必要ない部分の削除や簡略化です。以下に改善されたバージョンを示します。\n\n```javascript\n/**\n * ユーザーが安全でない場所を選択しないようにし、適切な保存場所を選択するか操作をキャンセルするまでダイアログを表示します。\n * @param showDialogFunction ダイアログを表示する関数\n */\nconst retryShowSaveDialogUntilValid = async <\n  T extends Electron.OpenDialogReturnValue | Electron.SaveDialogReturnValue\n>(\n  showDialogFunction: () => Promise<T>\n): Promise<T> => {\n  const unsafeDirs = [appDirPath, app.getPath(\"userData\")];\n  \n  while (true) {\n    const result = await showDialogFunction();\n    // キャンセルされた場合、結果を直ちに返す\n    if (result.canceled) return result;\n    \n    // 選択されたファイルパスを取得\n    const filePath = result.filePaths ? result.filePaths[0] : result.filePath;\n    if (!filePath) return result; // filePathが未定義の場合、結果を返す\n    \n    // 選択されたパスが安全かどうかを確認\n    if (isPathUnsafe(filePath, unsafeDirs)) {\n      const shouldRetry = await showWarningDialog();\n      if (!shouldRetry) return result; // ユーザーが警告を無視して保存を選択した場合\n    } else {\n      return result; // 安全なパスが選択された場合\n    }\n  }\n};\n\n/**\n * 指定されたパスが安全でないかどうかを判断します。\n */\nconst isPathUnsafe = (filePath, unsafeDirs) => {\n  return unsafeDirs.some(unsafeDir => {\n    const relativePath = path.relative(unsafeDir, filePath);\n    return !path.isAbsolute(relativePath) && !relativePath.startsWith('..');\n  });\n};\n\n/**\n * 警告ダイアログを表示し、ユーザーが再試行を選択したかどうかを返します。\n */\nconst showWarningDialog = async () => {\n  const warningResult = await dialog.showMessageBox(win, {\n    message: \"指定された保存先は自動的に削除される可能性があります。\",\n    type: \"warning\",\n    buttons: [\"保存場所を変更\", \"無視して保存\"],\n    defaultId: 0,\n    title: \"警告\",\n    detail: \"本当にこの場所に保存しますか？\",\n    cancelId: 0,\n  });\n  return warningResult.response === 0; // 0: 再試行, 1: 無視して保存\n};\n```\n\nこのバージョンでは、次の変更を行いました：\n\n- 無駄な変数の削除や簡略化を行い、コードの読みやすさを向上させました。\n- `isPathUnsafe` と `showWarningDialog` というヘルパー関数を導入し、コードの再利用性を高め、主関数の複雑さを減らしました。\n- コメントを追加して、各部分の目的を明確にしました。","turn_id":"turn_000003"},"target_developer_prompt":{"create_time":1708195568.230819,"event_index":2,"role":"user","source_node_id":"aaa245df-e994-42b9-8ee4-5f85cb4f0268","source_parent_id":"6b2d0f49-1392-4814-a27d-ad19f1a5e4d5","source_record_index":2,"text":"このソースコードをシンプルにしつつもわかりやすいコードにしてください。\n\n/**\n * 保存に適したフォルダを選択するかキャンセルをするまでダイアログを繰り返し表示し続ける\n * @param showDialogFunction ダイアログを表示する関数\n */\nconst retryShowSaveDialogWhileSafeDir = async <\n  T extends Electron.OpenDialogReturnValue | Electron.SaveDialogReturnValue\n>(\n  showDialogFunction: () => Promise<T>\n): Promise<T> => {\n  const unsafeSaveDirs = [appDirPath, app.getPath(\"userData\")];\n  let retry: boolean;\n  let result: T;\n  do {\n    retry = false;\n    result = await showDialogFunction();\n    let filePath: string;\n    if (result.canceled) {\n      return result;\n    }\n    if (\"filePaths\" in result) {\n      filePath = result.filePaths[0];\n    } else {\n      if (result.filePath == undefined) {\n        return result;\n      }\n      filePath = result.filePath;\n    }\n    for (const unsafeDir of unsafeSaveDirs) {\n      const relativePath = path.relative(unsafeDir, filePath);\n      if (\n        !(\n          path.isAbsolute(relativePath) ||\n          relativePath === \"..\" ||\n          relativePath.startsWith(`..${path.sep}`)\n        )\n      ) {\n        const warningResult = await dialog.showMessageBox(win, {\n          message: \"指定された保存先は自動的に削除される可能性があります。\",\n          type: \"warning\",\n          buttons: [\"保存場所を変更\", \"無視して保存\"],\n          defaultId: 0,\n          title: \"警告\",\n          detail: \"本当にこの場所に保存しますか？\",\n          cancelId: 0,\n        });\n        if (warningResult.response == 0) {\n          retry = true;\n        }\n        break;\n      }\n    }\n  } while (retry);\n  return result;\n};","turn_id":"turn_000002"}},"csv_extraction":{"context":[{"category":"context","evidence_spans":["const retryShowSaveDialogWhileSafeDir = async <\n  T extends Electron.OpenDialogReturnValue | Electron.SaveDialogReturnValue\n>(\n  showDialogFunction: () => Promise<T>\n): Promise<T> => {"],"item_id":"context_1","normalized_text":"対象は、ElectronのOpenDialogReturnValueまたはSaveDialogReturnValueを返すダイアログ関数を受け取る非同期関数retryShowSaveDialogWhileSafeDirである。","source_roles":["user"],"source_turn_ids":["turn_000002"]},{"category":"con